First Name,Last Name,ID,Stream,Preference 1,Preference 2,Preference 3,Preference 4,Preference 5,Preference 6,Preference 7,Preference 8,Preference 9,Preference 10
Hayley,Mills,60836263,CS,flaunting buttocks,cooking fancy food,proving math theorems,starring in Hollywood movies,singing pop songs,campaigning for the presidency,starring in musical comedies,manipulating ingenues,coining sparkling witticisms,playing the piano
Rod,Taylor,40081989,CS,promoting liberal values,attacking neighbors,drawing whimsical cartoons,spreading revolution,making provocative documentaries,starring in Hollywood movies,painting abstract paintings,avoiding paparazzi,attacking paparazzi,campaigning for the presidency
Peter,Scolari,99252408,CS,writing about manly pursuits,starring in romantic comedies,singing pop songs,leaking state secrets,winning boxing matches,ranting about liberals,making unauthorized sex tapes,directing violent movies,composing classical music,teaching philosophy
Heavy,D,98807048,CS,barking orders at subordinates,making insipid musicals,promoting pacifism,defending the weak,betraying friends,singing protest songs,managing hedge funds,coining sparkling witticisms,selling military secrets,shopping for shoes
Barbara,Hershey,77577905,CS,teaching philosophy to future leaders,writing pop songs,promoting conservative values,writing pop songs,punishing crime,writing pop songs,popping amphetamines,promoting humanism,studying science,developing military strategies
John,Brown,63249375,CS,womanizing,making propagandistic movies,directing violent movies,ranting about liberals,promoting new wars,developing real estate,fighting with swords,judging legal cases,fighting barbarian hordes,writing scripts
Twyla,Tharp,19976071,DS,avoiding work,killing teenagers,crushing dissent,running a multinational corporation,preening in front of the mirror,inventing new technologies,complaining about life,chasing a great white whale,promoting science,spying on girls
Al,Hirschfeld,60341998,DS,brewing magican potions,teaching magic,counting money,hunting monsters,writing comedy,guarding the galaxy,running a criminal empire,deep-frying chicken,fighting for the rebel alliance,brewing magican potions
Beatrix,Potter,97805380,DS,running a multinational corporation,writing comedy,hacking into corporate mainframes,teaching the next generation,cheating at poker,disappointing suitors,running a crime family,defending the weak,killing teenagers,foiling the schemes of evil villains
James,Caan,86115687,CS,promoting humanism,stabbing in the back,singing jazz songs,leading armies into battle,promoting socialism,giving speeches,attacking neighbors,writing modern fiction,promoting pop music,hiding from the public
Frankie,Avalon,10061629,CS,managing hedge funds,managing large development projects,shopping for shoes,posing pointed questions,pushing haute couture,starring in Hollywood movies,promoting socialism,pushing dodgy operating systems,flaunting buttocks,running a media empire
Clint,Howard,75205309,DS,solving crimes,teaching magic,starring in comedies,killing teenagers,killing for Mi6,solving crimes,preening in front of the mirror,paying kickbacks to the police chief,teaching magic,solving crimes
Mark,Martin,54923394,CS,climbing social ladders,selling fast food,ranting about liberals,promoting liberal values,painting colorful pictures,writing pop songs,reading braille,cooking fancy food,teaching the next generation,running assembly lines
Albert,Finney,20844224,DS,promoting logical thinking,slashing victims,pioneering new technologies,dreaming the day away,cheating at golf,diagnosing diseases,reading Cosmopolitan,trimming bushes,pushing the hardline,promoting liberal values
Orlando,Bloom,87216969,DS,pioneering new technologies,promoting logical thinking,killing monsters,solving crimes,causing mayhem,solving crimes,amassing wealth,keeping accounts,piloting a spaceship,chasing women
Aisha,Tyler,26477450,CS,judging legal cases,following the money,promoting socialism,writing pop songs,writing pop songs,frying peanut-butter and banana sandwiches,campaigning for the presidency,shopping for shoes,leaking classified documents,telling zany jokes
Ali,MacGraw,32936358,DS,manipulating political pawns,launching hostile takeovers,duelling acrobatically,studying magic tricks,making condescending remarks,chasing jellyfish,pulling pranks,writing comedy,developing new technologies,fighting in gladiator arenas
Ivana,Trump,63925669,CS,spreading political gossip,making propagandistic movies,writing mystery stories,plotting election strategies,writing pop songs,writing on wax tablets,writing pop songs,promoting feminism,campaigning for social causes,promoting conservative values
Tom,Welling,95469252,DS,saving money,killing monsters,flaunting foppish fashions,foiling the schemes of evil villains,amassing ill-gotten wealth,playing Baccarat,piloting a spaceship,making patronising comments,poisoning an apple,working for the forces of darkness
Roy,Orbison,99181169,DS,preventing crime,maintaining a secret identity,chasing jellyfish,applying science,chasing a great white whale,solving crimes,eating census takers,wisecracking,looking for love,finding clues
Dean,Jones,78049884,CS,running for the senate,posing pointed questions,womanizing,starring in Hollywood movies,singing pop songs,teaching philosophy,starring in Hollywood movies,starring in Hollywood movies,ranting about liberals,punishing crime
Mark,Twain,71760125,DS,pioneering new technologies,performing magic tricks,solving crimes,teaching the next generation,publishing newspapers,smiting frost giants,hunting demons,diagnosing diseases,running a clandestine spy organization,brewing magican potions
Sheldon,Leonard,97535435,CS,hosting a late night chat show,fomenting social revolution,amassing nuclear weapons,instigating rebellion,singing pop songs,studying computability,starring in Hollywood movies,studying economics,promoting pacifism,staring at the moon
Josh,Groban,39109770,DS,looking after children,foiling the schemes of evil villains,preventing crime,pioneering new technologies,taking bribes from organized crime,kicking ass,knocking out opponents,striving for world domination,making condescending remarks,collecting green Kryponite
Meadowlark,Lemon,48697607,CS,eating bugs,running a bureaucracy,starring in Hollywood movies,promoting conservative values,piloting the lunar module,coining sparkling witticisms,pulling faces,promoting vegetarianism,ranting about liberals,interviewing politicians
Don,Everly,30486981,CS,starring in musical comedies,challenging artistic norms,organizing a putsch,promoting monetarism,starring in action movies,recording pop songs,expressing dissent,fighting for democracy,making vulgar jokes,seducing women
Kourtney,Kardashian,28786342,DS,writing about sex,stealing human fat,solving crimes,finding clues,plotting criminal schemes,making silly decisions,building replicants,studying magic tricks,making condescending remarks,disappointing suitors
Spencer,Tracy,56634820,DS,amassing ill-gotten wealth,paying kickbacks to the police chief,maintaining a secret identity,interpreting evidence,creating nightmares,killing for Mi6,studying magic tricks,grabbing power,solving riddles,deep-frying chicken
Denholm,Elliott,22663048,CS,enriching uranium,leaking state secrets,going slowly mad,spreading political gossip,reporting the news,starring in Hollywood movies,promoting conservative values,plotting election strategies,singing pop songs,leading armies into battle
Clark,Gable,51155512,DS,guarding the galaxy,condescending to customers,poisoning an apple,writing about sex,solving crimes,turning it up to 11,maintaining a secret identity,solving crimes,solving mysteries,plotting with the enemy
Calvin,Klein,62868985,DS,blowing bubbles,running a multinational corporation,chasing a great white whale,kicking ass,finding clues,foiling the schemes of evil villains,casting magic spells,chasing jellyfish,running a crime family,crushing dissent
Max,Planck,49278116,CS,leading revolts,starring in romantic comedies,developing military strategies,complaining about capitalism,signing sports memorabilia,starring in reality TV shows,following the money,directing the business of state,making fantasy movies,promoting pacifism
Connie,Mack,23275737,DS,offering blessings,foiling the schemes of evil villains,promoting greed,starring in Hollywood movies,piloting a spaceship,kicking ass,eluding Republicans,revelling in blood spatter,slashing victims,fighting for justice
Will,Rogers,19119067,CS,making idealistic movies,writing on wax tablets,spying for the enemy,writing pop songs,reporting the news,bullying neighboring countries,winning tennis tournaments,starring in musical comedies,promoting monetarism,singing pop songs
Harve,Presnell,14355326,CS,making insipid musicals,promoting the Web,creating optical illusions,campaigning for the presidency,racking up marriages,writing modern fiction,amassing nuclear weapons,gyrating hips,campaigning for social causes,arguing with political opponents
Tom,Clancy,90101978,DS,shagging spies,stealing human fat,releasing the hounds,burping,solving crimes,attacking consumerism,terrorizing employees,solving crimes,reading the news,crushing dissent
Avril,Lavigne,79205852,CS,blanketing staff with memos,attacking neighbors,racking up marriages,cooking dinners,writing pop songs,barking orders at subordinates,amassing nuclear weapons,campaigning for the presidency,dancing to disco music,singing torch songs
Lyle,Waggoner,64308526,DS,promoting capitalism,preening in front of the mirror,eluding FBI profilers,deep-frying chicken,smoking Laramie Hi-Tars,spying on girls,going on commando missions,tracking down criminals,running a crime family,running a clandestine spy organization
Robert,Plant,84735962,DS,seducing toy boys,chasing jellyfish,duelling acrobatically,eluding Republicans,teaching magic,finding clues,solving crimes,terrorizing employees,laughing maniacally,casting magic spells
John,Mayer,45592766,CS,developing real estate,interviewing politicians,singing pop songs,starring in Hollywood movies,promoting socialism,leaking state secrets,developing military strategies,running a kingdom,hosting a late night chat show,hosting radio shows
Louis,Leakey,71663189,CS,promoting vegetarianism,leading armies into battle,promoting racial harmony,recording pop songs,writing modern fiction,making movies,running a criminal enterprise,amassing nuclear weapons,composing classical music,promoting Darwinism
Ty,Cobb,44454284,CS,writing modern fiction,developing military strategies,struggling with modern times,crushing dissent,fighting for democracy,sucking roots,selling cheap airline seats,expressing dissent,singing jazz songs,writing mystery stories
Desi,Arnaz,41497968,CS,teaching the next generation,writing scripts,promoting feminism,writing funny movies,developing military strategies,piloting the lunar module,dancing to disco music,starring in Hollywood movies,starring in Hollywood movies,interviewing politicians
Jackie,Gleason,22992448,DS,moaning about men,drinking tea,teaching magic,solving crimes,finding clues,studying magic tricks,fighting for justice,solving mysteries,running a crime family,looking for love
Gertrude,Stein,77202290,CS,getting plastic surgery,fighting with swords,running for the senate,frying peanut-butter and banana sandwiches,making insipid musicals,pulling dirty political tricks,leaking classified documents,cooking dinners,managing large development projects,starring in sit-coms
Buster,Keaton,63395066,DS,offering blessings,looking for love,disappointing suitors,going on commando missions,exorcising demons,devising evil schemes,revelling in blood spatter,drinking tea,starring in comedies,building replicants
Faith,Hill,75705178,CS,promoting healthy eating,preventing crime,singing Hipbop songs,writing novels,developing military strategies,raising new-age children,writing pop songs,issuing threats,ranting about liberals,running gentleman's clubs
John,Deacon,17646891,DS,stealing human fat,solving crimes,devising evil schemes,pursuing criminals,paying kickbacks to the police chief,defending the weak,interpreting evidence,tracking down criminals,guarding the galaxy,fighting for the rebel alliance
John,Hurt,93052080,CS,peacocking in fancy clothes,cracking enemy codes,making cars,racking up marriages,building giant walls,writing short stories,healing the sick,writing mystery stories,making fantasy movies,starring in Hollywood movies
George,Segal,15171227,CS,singing jazz songs,singing pop songs,writing short stories,writing bad movies,winning tennis tournaments,interviewing politicians,singing rock songs,creating optical illusions,promoting Scientology,enriching uranium
Anne,Robinson,63651056,CS,managing hedge funds,promoting monetarism,plotting election strategies,starring in Hollywood movies,teaching the next generation,enriching uranium,starring in Hollywood movies,promoting conservative values,running assembly lines,reading braille
Doc,Holliday,65769481,DS,saving money,spreading revolution,arresting criminals,meddling in the dark arts,brewing magican potions,paying kickbacks to the police chief,running a crime family,performing magic tricks,studying science,offering legal advice
Kathleen,Turner,20538234,CS,arguing with political opponents,writing on wax tablets,cheating clients,starring in sit-coms,pulling faces,leading revolts,collecting rock samples,giving speeches,singing pop songs,picking weird children names
Edward,Elgar,59022446,DS,offering legal advice,crushing dissent,solving crimes,eating carrots,losing court cases,pioneering new technologies,promoting the Dark Side,grabbing power,finding clues,looking for love
Don,Mattingly,41001148,DS,teaching the next generation,building replicants,winning heavyweight titles,solving mysteries,amassing wealth,spreading revolution,gossiping with galpals,starring in action movies,offering legal advice,inventing electrical marvels
Margaret,Mead,39707125,CS,starring in indy movies,making movies,hiding from the public,making madcap comedies,making unauthorized sex tapes,doing raunchy stage acts,pulling dirty political tricks,telling zany jokes,making unauthorized sex tapes,reading braille
Tom,Thumb,42283039,CS,writing short stories,scandalizing polite society,running a communist country,campaigning for the presidency,popping amphetamines,posing pointed questions,teaching the next generation,teaching philosophy,leaking classified documents,making fantasy movies
Nik,Kershaw,98576934,DS,playing rock guitar,ranting about minorities,solving crimes,tricking criminals,practicing the Occult,killing monsters,deep-frying chicken,teaching magic,solving crimes,reading Cosmopolitan
Barry,Manilow,72061519,CS,coining sparkling witticisms,making provocative documentaries,worrying about health,starring in Hollywood movies,campaigning for environmental causes,cracking the whip,singing pop songs,cooking dinners,winning tennis tournaments,promoting charity
David,Duchovny,19452400,DS,practicing the Occult,making money,shopping for shoes,fighting for the rebel alliance,inventing electrical marvels,selling tat,promoting the Dark Side,maintaining a secret identity,pushing the hardline,doing the Charleston
Peter,Graves,99538788,CS,interviewing celebrities,promoting vegetarianism,crushing dissent,offering advice,organizing a putsch,making cars,singing rock songs,studying science,licking frogs,ordering wire-taps
P.T.,Barnum,18016308,CS,promoting conservative values,singing jazz songs,throwing sex parties,promoting charity,winning boxing matches,winning tennis matches,competing in athletic events,staring at the moon,making fantasy movies,causing political scandals
Keri,Russell,78061019,DS,solving crimes,offering blessings,running a newspaper empire,keeping accounts,solving mysteries,solving crimes,moaning about men,promoting logical thinking,brewing magican potions,foiling the schemes of evil villains
Benito,Mussolini,69153676,CS,writing Hollywood movies,shopping for shoes,coining sparkling witticisms,drawing whimsical cartoons,amassing nuclear weapons,singing torch songs,pulling faces,defending plaintiffs,creating optical illusions,divorcing husbands
Carole,Lombard,54046384,CS,barking orders at subordinates,writing pop songs,stabbing in the back,campaigning for the presidency,developing new technologies,writing short stories,starring in Hollywood movies,pushing dodgy operating systems,selling fast food,suing large corporations
Richard,Rodgers,13943734,DS,laughing maniacally,running a clandestine spy organization,pioneering new technologies,making patronising comments,analyzing intelligence data,appreciating vintage collectibles,disappointing suitors,solving mysteries,fighting with swords,chasing women
Hugh,Beaumont,15307441,CS,betraying friends,writing modern fiction,Research Activity,barking orders at subordinates,running the FBI,studying economics,singing pop songs,running a criminal enterprise,healing the sick,fighting barbarian hordes
Cokie,Roberts,25477919,CS,singing rock songs,peacocking in fancy clothes,following the money,making political gaffes,going for a spacewalk,pushing haute couture,blanketing staff with memos,promoting Catholic values,writing novels,writing plays
Richard,Widmark,66158936,CS,pioneering new technologies,mass-producing cars,running assembly lines,writing Hollywood movies,staring at the moon,making cars,managing hedge funds,starring in Hollywood movies,decrying secrecy,avoiding paparazzi
Al,Pacino,99032262,CS,making witty remarks,explaining evolution,teaching the next generation,selling fast food,building giant walls,fighting with swords,directing Hollywood movies,promoting Kaballah,fighting with swords,dancing to disco music
Boris,Yeltsin,36614763,DS,counting money,running a multinational corporation,solving crimes,collecting green Kryponite,making money,devising evil schemes,pioneering new technologies,running a criminal empire,launching hostile takeovers,solving riddles
H.C.,Oersted,54454654,CS,hiding from the public,promoting racial harmony,making unauthorized sex tapes,singing middle-of-the-road songs,defending plaintiffs,singing pop songs,starring in Hollywood movies,promoting vegetarianism,singing pop songs,winning tennis matches
Morrissey,,48944333,CS,promoting monetarism,crushing dissent,racking up marriages,making threatening phone calls,starring in romantic comedies,running gentleman's clubs,making provocative documentaries,dancing to disco music,fighting with swords,singing pop songs
Dan,Blocker,68034155,DS,seducing young women,plotting with the enemy,maintaining a secret identity,rescuing aristocrats,running a criminal empire,studying science,hunting aliens,offering blessings,spying on girls,running a software company
Farrah,Fawcett,57946945,DS,making soap,interviewing celebrities,interpreting evidence,striving for world domination,taking bribes from organized crime,chasing jellyfish,making condescending remarks,solving riddles,applying science,devising evil schemes
Queen,Juliana,41936219,DS,fighting for the rebel alliance,causing mayhem,promoting science,fighting barbarian hordes,running a newspaper empire,making money,pursuing criminals,performing office chores,solving crimes,maintaining salon-quality hair
Loudon,Wainwright,83483335,CS,betraying friends,writing pop songs,making vague predictions,teaching the next generation,starring in sit-coms,singing rock songs,pushing haute couture,promoting socialism,organizing a putsch,starring in Hollywood movies
Tina,Yothers,96619958,DS,pulling pranks,diagnosing diseases,seducing young women,chasing rabbits,performing office chores,poisoning an apple,fighting for the rebel alliance,studying magic tricks,maintaining a secret identity,eating carrots
Joe,Lewis,51441493,CS,winning tennis matches,making unauthorized sex tapes,coining sparkling witticisms,starring in Hollywood movies,starring in indy movies,insulting minorities,proving math theorems,ranting about liberals,writing modern fiction,starring in Hollywood movies
Cyndi,Lauper,35438905,CS,causing political scandals,giving speeches,starring in Hollywood movies,writing pop songs,promoting conservative values,reporting the news,ruining an empire,singing pop songs,promoting feminism,peacocking in fancy clothes
Glenn,Miller,73709888,CS,starring in indy movies,starring in Hollywood movies,fighting with swords,ranting about liberals,promoting Catholic values,taking anabolic steroids,directing Hollywood movies,starring in Hollywood movies,spreading political gossip,proving math theorems
Mack,Sennett,55436779,CS,coining sparkling witticisms,running a media empire,coining sparkling witticisms,singing torch songs,writing pop songs,defending the weak,hosting radio shows,ruling over subjects,singing middle-of-the-road songs,singing pop songs
James,Gandolfini,76641818,CS,running a hardware company,dancing to disco music,running a communist country,producing Hipbop records,developing new technologies,licking frogs,piloting the lunar module,leading revolts,making threatening phone calls,starring in action movies
Burt,Ward,39225210,CS,cross-dressing in women's clothes,winning Oscars,singing pop songs,starring in sit-coms,teaching the next generation,singing pop songs,giving speeches,reporting the news,promoting vegetarianism,ranting about liberals
William,Schallert,32538339,DS,tracking down terrorists,inventing new technologies,maintaining a secret identity,swinging from tree to tree,making money,representing criminals,selling tat,writing about sex,flaunting foppish fashions,piloting a spaceship
Rob,Lowe,84335501,CS,blanketing staff with memos,writing Hollywood movies,dancing to disco music,chasing criminals,promoting liberal values,starring in Hollywood movies,directing violent movies,ranting about liberals,leaking classified documents,shopping for shoes
Frederick,Ashton,82249526,CS,singing pop songs,making unauthorized sex tapes,going for a spacewalk,starring in Hollywood movies,fighting barbarian hordes,running a media empire,defining words,running gentleman's clubs,betraying friends,ranting about liberals
Michelangelo,,60684965,CS,climbing social ladders,cooking dinners,peacocking in fancy clothes,singing pop songs,running a kingdom,singing pop songs,studying computability,starring in indy movies,starring in musical comedies,signing sports memorabilia
Demi,Lovato,81763442,CS,playing everyman characters,managing hedge funds,struggling with modern times,writing pop songs,proving math theorems,ranting about liberals,teaching philosophy,singing pop songs,running gentleman's clubs,making propagandistic movies
Andre,Michelin,39315987,CS,racing fast cars,spreading revolution,winning tennis matches,making cartoons,popping amphetamines,fighting for democracy,singing jazz songs,writing blues songs,promoting openness,ranting about liberals
Ken,Kesey,86454438,CS,making cars,selling military secrets,frying peanut-butter and banana sandwiches,pulling dirty political tricks,hosting a late night chat show,preventing crime,peacocking in fancy clothes,betraying friends,spreading philosophy,hiding from the public
Angie,Dickinson,76609425,CS,coining sparkling witticisms,coining sparkling witticisms,winning tennis tournaments,breaking records,making vulgar jokes,running a bureaucracy,writing on wax tablets,interpreting evidence,making insipid musicals,writing funny movies
Will,Clark,58225345,CS,seducing women,campaigning for the presidency,spying for the enemy,winning tennis tournaments,ranting about liberals,writing cook books,ranting about liberals,fighting with swords,constructing an ironic public image,writing pop songs
Billy,Mitchell,36508787,CS,enriching uranium,promoting liberal values,writing pop songs,climbing social ladders,starring in Hollywood movies,shopping for shoes,suppressing minorities,starring in Hollywood movies,struggling with modern times,studying science
Billy,Mitchell,27324813,DS,finding clues,starring in animated movies,teaching the next generation,promoting greed,hunting rabbits,meddling in the dark arts,commanding a whaling ship,offering blessings,defending the weak,exorcising demons
Rory,Calhoun,58556418,CS,frying peanut-butter and banana sandwiches,developing new technologies,singing pop songs,winning boxing matches,cooking dinners,starring in reality TV shows,interviewing politicians,writing on wax tablets,creating optical illusions,campaigning for the presidency
L.L.,Bean,21206509,CS,promoting conservative values,starring in romantic comedies,singing pop songs,promoting big business,manipulating ingenues,singing pop songs,singing pop songs,writing pop songs,gyrating hips,writing pop songs
Sergei,Rachmaninoff,40899002,CS,selling military secrets,hiding from the public,instigating rebellion,composing classical music,ruining an empire,ranting about liberals,promoting charity,winning gold medals,barking orders at subordinates,singing pop songs
Booker,T,28868121,CS,singing pop songs,winning tennis matches,crushing dissent,singing pop songs,selling fast food,causing political scandals,posing pointed questions,publishing newspapers,promoting conservative values,insulting minorities
John,Tesh,82588127,CS,raising new-age children,starring in Hollywood movies,starring in Hollywood movies,running the FBI,starring in Hollywood movies,writing modern fiction,betraying friends,studying computability,cracking the whip,singing rock songs
Crystal,Gayle,67286874,DS,preventing crime,representing criminals,promoting capitalism,punishing criminals,running a crime family,running a multinational corporation,chasing women,hunting demons,plotting criminal schemes,promoting liberal values
Melissa,Etheridge,63969792,DS,preventing crime,attacking consumerism,appreciating vintage collectibles,working for the forces of darkness,drinking tea,analyzing the sub-conscious,teaching the next generation,duelling acrobatically,avoiding work,running a crime family
